{
  "path": "/language/en/phd_thesis/",
  "sourceUrl": "https://doctoradoia.dia.fi.upm.es/language/en/phd_thesis/",
  "wordpressId": 87,
  "meta": {
    "title": "Elaboration and Evaluation of the PhD Thesis - Doctorado en Inteligencia Artificial",
    "robots": "noindex, nofollow",
    "ogType": "article",
    "published": "2017-07-24T05:57:51+00:00",
    "modified": "2024-09-04T00:42:22+00:00",
    "breadcrumb": "Elaboration and Evaluation of the PhD Thesis"
  },
  "content": {
    "hero": {
      "eyebrow": {
        "title": "Usual procedures"
      },
      "title": "Doctoral Thesis",
      "subtitle": "The indications on the development of doctoral studies at the UPM, the preparation of the doctoral thesis, its defense, its evaluation, etc., are included in the state, regional, and UPM regulations. . This regulation <strong>can be consulted at this <a href=\"https://www.upm.es/Estudiantes/Estudios_Titulaciones/Estudios_Doctorado/normativa\" target=\"_blank\" rel=\"noreferrer noopener\">link</a></strong><br><br>The most common procedures are highlighted below, for illustrative purposes"
    },
    "steps": {
      "tabs": [
        "1. Development of the doctoral thesis",
        "2. Prior evaluation of the doctoral thesis",
        "3. Thesis Submission Request and Examiner Panel Proposal",
        "4. Next procedures"
      ],
      "panels": [
        {
          "body": "<p>a) Throughout the development of the research leading to the preparation and defense of the doctoral thesis, the student must complete, annually – within the deadlines indicated – and on a mandatory basis, the following two documents:</p>\n<ul class=\"wp-block-list\">\n<li>A <strong>Research Plan</strong> that will be evaluated and reported by the director or directors of the thesis and by the CAPD. This document must be submitted by the doctoral student in a timely manner (failure to do so may result in withdrawal from the Program). <strong><a href=\"https://www.upm.es/Estudiantes/Estudios_Titulaciones/Estudios_Doctorado/PlanesAnuales\" target=\"_blank\" rel=\"noreferrer noopener\">In this link</a></strong> you can obtain more information about it.</li>\n<li>An <strong>Activity Document</strong>, which will be evaluated by the CAPD. <strong><a href=\"/wp-content/uploads/sites/8/2023/12/Plantilla-DocActividades-v.4reyes.xlsx\" target=\"_blank\" rel=\"noreferrer noopener\">In this link</a></strong> you can download the template to use the first year. In successive years the same file will be completed, highlighting in some way what has been done in each year.</li>\n</ul>\n<p>b) Doctoral students can request three types of <strong>mention to their doctoral degree</strong>. They are indicated below, along with the link that refers to the regulations that regulate it:</p>\n<ul class=\"wp-block-list\">\n<li><strong>Mention “<a href=\"https://www.upm.es/Estudiantes/Estudios_Titulaciones/Estudios_Doctorado/Tesis/mencion\" target=\"_blank\" rel=\"noreferrer noopener\">International Doctorate</a>”</strong></li>\n<li><strong>Mention “<a href=\"https://www.upm.es/Estudiantes/Estudios_Titulaciones/Estudios_Doctorado/Tesis/doctoradoIndustrial\" target=\"_blank\" rel=\"noreferrer noopener\">Industrial Doctorate</a>”</strong></li>\n<li><strong><a href=\"https://www.upm.es/Estudiantes/Estudios_Titulaciones/Estudios_Doctorado/Tesis/cotutelaInternacional\" target=\"_blank\" rel=\"noreferrer noopener\">Thesis under international co-tutorship</a></strong></li>\n</ul>\n<p>c) <strong>Other procedures</strong> that the doctoral student can carry out are those indicated below. For all of them, the doctoral student must first read the <strong><a href=\"https://www.upm.es/Estudiantes/Estudios_Titulaciones/Estudios_Doctorado/normativa\" target=\"_blank\" rel=\"noreferrer noopener\">regulations that regulate it and the forms to be presented</a></strong>. Applications will generally be submitted through the THESIS platform; and for cases in which this option is not yet enabled, they will be presented by email (preferably with a digital signature).</p>\n<ul class=\"wp-block-list\">\n<li>Request for change of dedication.</li>\n<li>Request for extensions – ordinary and extraordinary – for the deposit of the thesis.</li>\n<li>Request for temporary withdrawal from the program.</li>\n<li>Request for co-supervision of the doctoral thesis.</li>\n<li>Request to change tutor and/or director.</li>\n<li>Application for an international stay to obtain an International Mention.</li>\n<li>etc.</li>\n</ul>"
        },
        {
          "body": "<p>In general terms, for a doctoral thesis to be admitted for defense, it must have at least one article admitted for definitive publication in a journal indexed in the Journal Citation Reports (JCR) up to the third quartile (Q3) of the last year. published or the year of production of the merit.</p>\n<p>When the doctoral thesis is close to completion, the doctoral student can request its prior evaluation through the THESIS platform.</p>\n<p>The steps to be taken are included in the <strong><em><a href=\"/documents/upm/Reglamento-de-Elaboracion-y-Evaluacion-de-Tesis.pdf\" target=\"_blank\" rel=\"noreferrer noopener\">Regulations for the Preparation and Evaluation of the Doctoral Thesis</a></em></strong>. However, <strong><a href=\"/wp-content/uploads/sites/8/2024/09/1_ProtocoloEvaluacionPrevia_alumno-3.pdf\" target=\"_blank\" rel=\"noreferrer noopener\">at this link</a></strong> (link to the prior evaluation protocol) you can download a protocol that we have prepared, which contains indications, suggestions and answers to questions raised in previous applications.</p>"
        },
        {
          "body": "<p>Once the doctoral thesis is complete, the doctoral candidate may request the submission of their thesis via the THESIS platform. The Committee for Academic Programmes and Doctoral Studies (CAPD) will propose the panel to evaluate the defense, although the doctoral candidate may suggest potential members who are doctors and experts in the field.</p>\n<p>The steps to follow are outlined in the <strong><em><a href=\"/documents/upm/Reglamento-de-Elaboracion-y-Evaluacion-de-Tesis.pdf\" target=\"_blank\" rel=\"noreferrer noopener\">Regulations for the Preparation and Evaluation of the Doctoral Thesis</a></em></strong>. However, a protocol that we have developed can be downloaded from <strong><a href=\"/wp-content/uploads/sites/8/2024/09/Deposito-y-tribunal-1.zip\" target=\"_blank\" rel=\"noreferrer noopener\">this link</a></strong> , containing instructions, suggestions, and answers to questions raised in previous applications.</p>"
        },
        {
          "body": "<p>Once the deposit and the court are approved by the CAPD, the documentation must follow a series of procedures, which are listed below:</p>\n<ul class=\"wp-block-list\">\n<li>The International Doctoral School (EID) receives the documentation, reviews formal aspects, and interacts with the doctoral student and with the CAPD if any modification or correction is necessary.</li>\n<li>Once the documentation is correct, the EID formalizes the deposit. The thesis must be on public display for 15 days.</li>\n<li>After 15 days, and if there has been no allegation, the EID sends the documentation to the Doctoral Area Commission (CAD) to schedule a meeting.</li>\n<li>When the CAD has authorized the defense and the court has approved it, it will issue the corresponding official letters – which will be available on the THESIS platform.</li>\n<li>From that moment -and not before-, you can begin to organize the defense act.</li>\n<li>After the defense and evaluation, the doctor can apply for the title.</li>\n</ul>"
        }
      ]
    }
  }
}
