{
  "path": "/language/en/information/",
  "sourceUrl": "https://doctoradoia.dia.fi.upm.es/language/en/information/",
  "wordpressId": 69,
  "meta": {
    "title": "Information - Doctorado en Inteligencia Artificial",
    "robots": "noindex, nofollow",
    "ogType": "article",
    "published": "2017-07-24T05:59:40+00:00",
    "modified": "2026-07-06T12:42:35+00:00",
    "breadcrumb": "Information"
  },
  "content": {
    "hero": {
      "eyebrow": {
        "title": ""
      },
      "title": "Additional information",
      "subtitle": ""
    },
    "resources": {
      "tabs": [
        "Information provided by the university",
        "Regulations of the PhD Programme",
        "Information about the implementation and development of the PhD Programme",
        "<a href=\"/wp-content/uploads/sites/8/2023/12/Repositorio-tesis-RD99_2011-v1r.xlsx\">PhD thesis defended in the programme (developed under RD 99/2011)</a>",
        "<a href=\"https://www.upm.es/Estudiantes/Estudios_Titulaciones/Estudios_Doctorado/Tesis/Impresos\" data-type=\"link\" data-id=\"https://www.upm.es/Estudiantes/Estudios_Titulaciones/Estudios_Doctorado/Tesis/Impresos\" target=\"_blank\" rel=\"noreferrer noopener\">Forms relating to the preparation and defence of the thesis</a>"
      ],
      "panels": [
        {
          "body": "<ul class=\"wp-block-list\">\n<li><a href=\"https://www.upm.es/FuturosEstudiantes/InformacionEstudiantes\" target=\"_blank\" rel=\"noreferrer noopener\"><strong>New student information</strong></a></li>\n<li><a href=\"http://www.upm.es/Estudiantes/Estudios_Titulaciones/Estudios_Doctorado/preguntas_frecuentes\" target=\"_blank\" rel=\"noreferrer noopener\"><strong>FAQs about the PhD programme at the UPM</strong></a></li>\n<li><a href=\"http://www.upm.es/Estudiantes/BecasAyudasPremios\" target=\"_blank\" rel=\"noreferrer noopener\"><strong>Scholarships, Grants and Awards</strong></a></li>\n<li><a href=\"http://www.upm.es/Estudiantes/Estudios_Titulaciones/Estudios_Doctorado/ayudas\" target=\"_blank\" rel=\"noreferrer noopener\"><strong>Aids for the realisation of PhD Programme</strong></a></li>\n<li><a href=\"http://www.upm.es/Estudiantes/Movilidad\" target=\"_blank\" rel=\"noreferrer noopener\"><strong>Mobility. Exchange Programmes</strong></a></li>\n<li><a href=\"http://www.upm.es/Estudiantes/Atencion\" target=\"_blank\" rel=\"noreferrer noopener\"><strong>Student Service</strong></a></li>\n<li><a href=\"https://www.upm.es/Estudiantes/EmpleoPracticas\" target=\"_blank\" rel=\"noreferrer noopener\"><strong>Employment and Trainee</strong></a></li>\n<li><a href=\"http://www.upm.es/Estudiantes/ActividadesDeportivas\" target=\"_blank\" rel=\"noreferrer noopener\"><strong>Sport Activities</strong></a></li>\n<li><a href=\"http://www.upm.es/Estudiantes/CompromisoSocial\" target=\"_blank\" rel=\"noreferrer noopener\"><strong>Social Commitment</strong></a></li>\n<li><a href=\"http://www.upm.es/Estudiantes/Seguros\" target=\"_blank\" rel=\"noreferrer noopener\"><strong>Insurances</strong></a></li>\n</ul>"
        },
        {
          "body": "<ul class=\"wp-block-list\">\n<li><a href=\"http://www.upm.es/Estudiantes/Estudios_Titulaciones/Estudios_Doctorado/normativa\" target=\"_blank\" rel=\"noreferrer noopener\"><strong>Regulations and Legislations of the PhD Programme</strong></a></li>\n<li><a href=\"/documents/upm/Guia-de-buenas-practicas-junio-2017.pdf\" target=\"_blank\" rel=\"noreferrer noopener\"><strong>Good practice guide</strong></a></li>\n</ul>"
        },
        {
          "body": "<p><a href=\"/wp-content/uploads/sites/8/2024/05/9_Renov-acredit_resolucion-ConsejoUniversidades.pdf\" target=\"_blank\" rel=\"noreferrer noopener\"><strong>Renewal of the programme’s accreditation – Resolution</strong></a></p>\n<p><a href=\"/wp-content/uploads/sites/8/2024/05/7_Informe-autoevaluacion-renovac-acredit.pdf\" target=\"_blank\" rel=\"noreferrer noopener\"><strong>Renovation of the accreditation of the programme. Self-evaluation report submitted.</strong></a></p>\n<p><a href=\"https://www.educacion.gob.es/ruct/estudio.action?codigoCiclo=SC&amp;codigoTipo=D&amp;CodigoEstudio=5600401&amp;actual=estudios\" target=\"_blank\" rel=\"noreferrer noopener\"><strong>Record of Universities, Centres and Degrees with the information related to the Programme</strong></a></p>\n<p><a href=\"/wp-content/uploads/sites/8/2024/05/9_Renov-acredit_resolucion-ConsejoUniversidades.pdf\" target=\"_blank\" rel=\"noreferrer noopener\"><strong>Verification resolution from the Council of Universities (Ministry of Education, Culture and Sports)</strong></a> (Implementation date 2013-2014)</p>\n<p><strong>Assessment about the application for verification of the Programme conducted by ANECA.</strong></p>\n<p><a href=\"/wp-content/uploads/sites/8/2024/05/1_MemoVerificada.pdf\" target=\"_blank\" rel=\"noreferrer noopener\"><strong>Report of the Programme verified</strong></a></p>",
          "body2": "<p><a href=\"/wp-content/uploads/sites/8/2026/07/ANX_PR-ES-007_01-Informe-seguimiento-PDIA-final.pdf\">2023–2024 Academic Year Progress Report</a></p>\n<p></p>\n<p><a href=\"/wp-content/uploads/sites/8/2026/07/ANX_PR-ES-007_01-Informe-seguimiento-PDIA-2024-2025.pdf\">2024–2025 Academic Year Progress Report</a></p>\n<p></p>\n<p></p>\n<p></p>"
        }
      ]
    }
  }
}
