{
  "path": "/language/en/training_activities/",
  "sourceUrl": "https://doctoradoia.dia.fi.upm.es/language/en/training_activities/",
  "wordpressId": 103,
  "meta": {
    "title": "Training Activities - Doctorado en Inteligencia Artificial",
    "robots": "noindex, nofollow",
    "ogType": "article",
    "published": "2021-01-12T12:06:01+00:00",
    "modified": "2025-02-19T11:10:15+00:00",
    "breadcrumb": "Training Activities"
  },
  "content": {
    "hero": {
      "title": "Doctoral Training Activities in Artificial Intelligence",
      "subtitle": "Transversal Training"
    },
    "intro": {
      "body": "<p class=\"has-ast-global-color-5-color has-text-color has-link-color wp-elements-38a9f7359922378ab3759048c46b4ecf\">The training activities of the program – which are mandatory for all doctoral candidates – are those listed below.</p>\n<p class=\"has-ast-global-color-5-color has-text-color has-link-color wp-elements-046f84ae14cf457326bd2978aecaafa4\"><strong>(*) Obtaining a favorable report on the program’s training activities is a prerequisite for defending the doctoral thesis. To achieve this, it is necessary to have participated and received a ‘satisfactory’ grade in at least 80% of them (i.e., in eight of them), provided that the training activities undertaken allow for the attainment of all the competencies indicated in the title’s verification report associated with the Training Activities (these competencies can be consulted <a href=\"/wp-content/uploads/sites/8/2017/07/7dCompetencias.xlsx\" target=\"_blank\" rel=\"noreferrer noopener\">here</a>.</strong></p>"
    },
    "schedule": {
      "intro": "<p class=\"has-ast-global-color-5-color has-text-color has-link-color wp-elements-334826ee18a496b083d3f7fca0190f94\">The dates, times, and locations for the Training Activities for the 2024-25 academic year are listed in the following table:</p>",
      "tableId": 30,
      "columns": [
        "",
        "Activity",
        "Professors",
        "In person",
        "Date: hour"
      ],
      "rows": [
        [
          "A1",
          "Research Methodology",
          "<a href=\"https://dssc.fi.upm.es/verSeminario.php?seminario=210&amp;lang=1&amp;plan=1&amp;actividad=1\" target=\"_blank\" rel=\"noopener\">Andrés Silva (DSSC)</a>",
          "<a href=\"https://dssc.fi.upm.es/verSeminario.php?seminario=210&amp;lang=1&amp;plan=1&amp;actividad=1\" target=\"_blank\" rel=\"noopener\">Information</a>",
          "2026:<br>\n14 October, 17:00-19:00<br>\n21 October, 17:00-19:00<br>\n28 October, 17:00-19:00<br>\n04 November, 17:00-19:00<br>\n11 November, 17:00-19:00<br>\n18 November, 17:00-19:00<br>\n25 November, 17:00-19:00<br>\n02 December, 17:00-19:00"
        ],
        [
          "A2",
          "PhD Symposium",
          "Organizada por EID-UPM",
          "Organizada por EID-UPM",
          ""
        ],
        [
          "A3",
          "Research workshops: how to write an article and how to deliver a presentation",
          "Víctor Maojo García,<br>\nAlfonso Rodríguez-Patón, <br>\nJelena Bobkina y<br>\nElena Montiel",
          "TBD<br>",
          "TBD<br>"
        ],
        [
          "A4",
          "Research workshops: usage of scientific data bases and bibliometrics",
          "Roberto Valle",
          "TBD<br>",
          "TBD<br>"
        ],
        [
          "A5",
          "Research workshops: experiment design",
          "Oscar Corcho, Víctor Maojo García",
          "TBD<br>",
          "TBD<br>"
        ],
        [
          "A6",
          "Research workshops: How to create a poster?",
          "Daniel Garijo",
          "TBD<br>",
          "TBD<br>"
        ],
        [
          "A7",
          "Research workshops: managing research projects",
          "TBD",
          "TBD<br>",
          "TBD<br>"
        ],
        [
          "A8",
          "Research workshops: protection of scientific results and Technology Transfer",
          "Angélica de Antonio",
          "TBD<br>",
          "TBD<br>"
        ]
      ]
    }
  }
}
