{
  "path": "/tesis_doctoral/",
  "sourceUrl": "https://doctoradoia.dia.fi.upm.es/tesis_doctoral/",
  "wordpressId": 57,
  "meta": {
    "title": "Elaboracio?n y evaluacio?n de la Tesis Doctoral - Doctorado en Inteligencia Artificial",
    "robots": "noindex, nofollow",
    "ogType": "article",
    "published": "2017-07-24T05:57:51+00:00",
    "modified": "2024-09-04T00:08:09+00:00",
    "breadcrumb": "Elaboracio?n y evaluacio?n de la Tesis Doctoral"
  },
  "content": {
    "hero": {
      "eyebrow": {
        "title": "Trámites habituales"
      },
      "title": "Tesis doctoral",
      "subtitle": "Las indicaciones sobre el desarrollo de los estudios de doctorado en la UPM, la elaboración de la tesis doctoral, su defensa, su evaluación, etc., se encuentran recogidas en la normativa estatal, autonómica, y propia de la UPM. Esta normativa <strong>se puede consultar en este <a href=\"https://www.upm.es/Estudiantes/Estudios_Titulaciones/Estudios_Doctorado/normativa\" target=\"_blank\" rel=\"noreferrer noopener\">enlace</a></strong> <br><br>Se resaltan a continuación, a efectos ilustrativos, los trámites más habituales"
    },
    "steps": {
      "tabs": [
        "1. Desarrollo de la tesis doctoral",
        "2. Evaluación previa de la tesis doctoral",
        "3. Solicitud de depósito y <br>propuesta de tribunal",
        "4. Trámites siguientes"
      ],
      "panels": [
        {
          "body": "<p>a) A lo largo del desarrollo de la investigación conducente a la elaboración y defensa de la tesis doctoral, el alumno debe realizar, anualmente -en los plazos que se le indiquen- y de modo obligatorio los dos siguientes documentos:</p>\n<ul class=\"wp-block-list\">\n<li>Un <strong>Plan de Investigación</strong> que será evaluado e informado por el director/a o directores de la tesis y por la CAPD. Este documento tiene que entregarlo el doctorando en tiempo y forma (no hacerlo puede suponer la baja en el Programa). <strong><a href=\"https://www.upm.es/Estudiantes/Estudios_Titulaciones/Estudios_Doctorado/PlanesAnuales\" target=\"_blank\" rel=\"noreferrer noopener\">En este enlace</a></strong> se puede obtener más información al respecto.</li>\n<li>Un <strong>Documento de Actividades</strong>, que será evaluado por la CAPD. <strong><a href=\"/wp-content/uploads/sites/8/2023/12/Plantilla-DocActividades-v.4reyes.xlsx\" target=\"_blank\" rel=\"noreferrer noopener\">En este enlace</a></strong> se puede descargar la plantilla a utilizar el primer año. En los años sucesivos se irá completando el mismo fichero, destacando de algún modo lo que se haya realizado en cada anualidad.</li>\n</ul>\n<p>b) Los doctorandos pueden solicitar tres tipos de <strong>mención a su título de doctor</strong>. Se indican a continuación, junto con el enlace que remite a la normativa que lo regula:</p>\n<ul class=\"wp-block-list\">\n<li><strong>Mención “<a href=\"https://www.upm.es/Estudiantes/Estudios_Titulaciones/Estudios_Doctorado/Tesis/mencion\" target=\"_blank\" rel=\"noreferrer noopener\">Doctorado Internacional</a>”</strong></li>\n<li><strong>Mención “<a href=\"https://www.upm.es/Estudiantes/Estudios_Titulaciones/Estudios_Doctorado/Tesis/doctoradoIndustrial\" target=\"_blank\" rel=\"noreferrer noopener\">Doctorado Industrial</a>”</strong></li>\n<li><strong><a href=\"https://www.upm.es/Estudiantes/Estudios_Titulaciones/Estudios_Doctorado/Tesis/cotutelaInternacional\" target=\"_blank\" rel=\"noreferrer noopener\">Tesis en régimen de cotutela internacional</a></strong></li>\n</ul>\n<p>c) <strong>Otros trámites</strong> que puede realizar el doctorando son los que se indican a continuación. Para todos ellos, el doctorando debe leer primero la <strong><a href=\"https://www.upm.es/Estudiantes/Estudios_Titulaciones/Estudios_Doctorado/normativa\" target=\"_blank\" rel=\"noreferrer noopener\">normativa que lo regula y los impresos a presentar</a></strong>. Las solicitudes se presentarán, en general, a través de la plataforma THESIS; y para los casos en los que aún no esté habilitada esa opción, se presentarán por correo electrónico (preferiblemente con firma digital).</p>\n<ul class=\"wp-block-list\">\n<li>Solicitud de cambio de dedicación.</li>\n<li>Solicitud de prórrogas -ordinaria y extraordinaria- para el depósito de la tesis.</li>\n<li>Solicitud de baja temporal en el programa.</li>\n<li>Solicitud de codirección de la tesis doctoral.</li>\n<li>Solicitud de cambio de tutor y/o director.</li>\n<li>Solicitud de realización de estancia internacional para la obtención de Mención Internacional.</li>\n<li>etc.</li>\n</ul>"
        },
        {
          "body": "<p>En líneas generales, para que una tesis doctoral pueda ser admitida a trámite de defensa deberá contar con al menos un artículo admitido para su publicación definitiva en una revista indexada en el Journal Citation Reports (JCR) hasta el tercer cuartil (Q3) del último año publicado o del año de producción del mérito.</p>\n<p>Cuando la tesis doctoral esté cercana a su finalización, el doctorando puede solicitar la evaluación previa de la misma a través de la plataforma THESIS.</p>\n<p>Los pasos a dar están recogidos en el <strong><em><a href=\"/documents/upm/Reglamento-de-Elaboracion-y-Evaluacion-de-Tesis.pdf\" target=\"_blank\" rel=\"noreferrer noopener\">Reglamento de Elaboración y Evaluación de la Tesis Doctoral</a></em></strong>. No obstante, <a href=\"/wp-content/uploads/sites/8/2024/09/1_ProtocoloEvaluacionPrevia_alumno-3.pdf\">en este enlace</a> se puede descargar un protocolo que hemos elaborado, que contiene indicaciones, sugerencias y respuestas a preguntas planteadas en solicitudes previas.</p>"
        },
        {
          "body": "<p>Una vez finalizada la tesis doctoral, el doctorando puede solicitar el depósito de su tesis a través de la plataforma THESIS. Será la CAPD la que proponga el tribunal que ha de juzgar la defensa, pero el doctorando puede hacer una sugerencia de miembros posibles, que sean doctores y expertos en el área.</p>\n<p>Los pasos a dar están recogidos en el <strong><em><a href=\"/documents/upm/Reglamento-de-Elaboracion-y-Evaluacion-de-Tesis.pdf\" target=\"_blank\" rel=\"noreferrer noopener\">Reglamento de Elaboración y Evaluación de la Tesis Doctoral</a></em></strong>. No obstante, se puede descargar un protocolo que hemos elaborado, que contiene indicaciones, sugerencias y respuestas a preguntas planteadas en solicitudes previas, e impresos a utilizar.</p>\n<div class=\"wp-block-file alignfull\"><a href=\"/wp-content/uploads/sites/8/2024/09/Deposito-y-tribunal-1.zip\" class=\"wp-block-file__button wp-element-button\" download=\"\">Descarga impresos</a></div>"
        },
        {
          "body": "<p>Una vez aprobado el depósito y el tribunal por la CAPD, la documentación debe seguir una serie de trámites, que se enumeran a continuación:</p>\n<ul class=\"wp-block-list\">\n<li>La Escuela Internacional de Doctorado (EID) recibe la documentación, revisa aspectos formales, e interacciona con el doctorando y con la CAPD en caso de ser necesaria alguna modificación o corrección.</li>\n<li>Una vez está correcta la documentación, la EID formaliza el depósito. La tesis tiene que estar en exposición pública 15 días.</li>\n<li>Pasados los 15 días, y en caso de que no haya habido ninguna alegación, la EID remite la documentación a la Comisión de Área Doctoral (CAD) para que lo agende en una reunión.</li>\n<li>Cuando la CAD haya autorizado la defensa y aprobado el tribunal, emitirá los oficios correspondientes -que quedarán disponibles en la plataforma THESIS-.</li>\n<li>A partir de ese momento -y no antes-, se puede comenzar a organizar el acto de defensa.</li>\n<li>Tras la defensa y evaluación, el doctor puede solicitar el título.</li>\n</ul>"
        }
      ]
    }
  }
}
